{
  "schemaVersion": 1,
  "runId": "run-01J5E3WJ6B9FJ9Z6KBK1P2V6J7",
  "project": {
    "id": "agent-loop-orchestrator",
    "repositoryRoot": "/workspaces/agent-loop-orchestrator",
    "repositoryIdentity": "github:moritzbrantner/agent-loop-orchestrator"
  },
  "workItem": {
    "id": "task-42",
    "version": 1,
    "title": "Add dependency-aware task selection",
    "description": "Select only tasks whose blockers are complete and whose write scopes do not overlap active runs.",
    "dependsOn": [
      "task-41"
    ],
    "scope": {
      "include": [
        "src/scheduler/**",
        "tests/scheduler/**"
      ],
      "exclude": [
        "migrations/**"
      ]
    }
  },
  "baseline": {
    "gitSha": "1111111111111111111111111111111111111111",
    "ref": "refs/heads/main",
    "dirty": false
  },
  "conventionSelection": {
    "ids": [
      "AGENT-002",
      "AGENT-003",
      "AGENT-004",
      "GIT-001"
    ],
    "resolvedDigest": "sha256:aaaaaaaaaaaaaaaaaaaaaaaaaaaaaaaaaaaaaaaaaaaaaaaaaaaaaaaaaaaaaaaa"
  },
  "toolingManifest": {
    "digest": "sha256:bbbbbbbbbbbbbbbbbbbbbbbbbbbbbbbbbbbbbbbbbbbbbbbbbbbbbbbbbbbbbbbb",
    "capabilities": [
      "format:check",
      "lint",
      "typecheck",
      "test:unit",
      "test:integration"
    ]
  },
  "agent": {
    "adapter": "codex",
    "identity": "slice-implementer",
    "model": "gpt-5.6-sol",
    "reasoningLevel": "max",
    "configurationDigest": "sha256:cccccccccccccccccccccccccccccccccccccccccccccccccccccccccccccccc"
  },
  "authority": {
    "readRoots": [
      "/workspaces/agent-loop-orchestrator"
    ],
    "writeRoots": [
      "/worktrees/run-42"
    ],
    "network": {
      "mode": "allowlist",
      "allowedDomains": [
        "github.com",
        "api.github.com"
      ]
    },
    "tools": [
      "git",
      "coding-tooling",
      "moonlight"
    ],
    "secretRefs": [
      "github-token"
    ],
    "maxDurationSeconds": 7200,
    "maxAttempts": 2,
    "mayIntegrate": false,
    "mayPublish": false
  },
  "status": "awaiting_decision",
  "attempts": [
    {
      "id": "attempt-1",
      "number": 1,
      "outcome": "candidate_produced",
      "workspace": {
        "kind": "git-worktree",
        "path": "/worktrees/run-42"
      },
      "startedAt": "2026-08-14T13:30:00Z",
      "finishedAt": "2026-08-14T13:47:00Z",
      "candidate": {
        "identity": {
          "gitSha": "2222222222222222222222222222222222222222"
        },
        "changedPaths": [
          "src/scheduler/mod.rs",
          "tests/scheduler/dependencies.rs"
        ],
        "producedAt": "2026-08-14T13:45:00Z"
      },
      "checks": [
        {
          "capability": "test:unit",
          "component": "orchestrator-service",
          "candidate": {
            "gitSha": "2222222222222222222222222222222222222222"
          },
          "outcome": "passed",
          "exitCode": 0,
          "startedAt": "2026-08-14T13:45:10Z",
          "finishedAt": "2026-08-14T13:45:40Z",
          "evidence": [
            {
              "kind": "test-report",
              "uri": "orchestrator://evidence/test-report-42",
              "digest": "sha256:dddddddddddddddddddddddddddddddddddddddddddddddddddddddddddddddd",
              "mediaType": "application/json",
              "createdAt": "2026-08-14T13:45:40Z"
            }
          ]
        }
      ],
      "evaluations": [
        {
          "evaluator": "moonlight",
          "candidate": {
            "gitSha": "2222222222222222222222222222222222222222"
          },
          "outcome": "passed",
          "summary": "Candidate preserves baseline behavior and satisfies the scheduler scenario.",
          "startedAt": "2026-08-14T13:46:00Z",
          "finishedAt": "2026-08-14T13:47:00Z",
          "evidence": [
            {
              "kind": "moonlight-report",
              "uri": "orchestrator://evidence/moonlight-42",
              "digest": "sha256:eeeeeeeeeeeeeeeeeeeeeeeeeeeeeeeeeeeeeeeeeeeeeeeeeeeeeeeeeeeeeeee",
              "mediaType": "application/json",
              "createdAt": "2026-08-14T13:47:00Z"
            }
          ]
        }
      ]
    }
  ],
  "createdAt": "2026-08-14T13:29:00Z",
  "updatedAt": "2026-08-14T13:47:00Z"
}
